{
  "captured_at": "2026-01-01T00:00:00Z",
  "consumer": {
    "datahub_urn": "urn:li:dataset:(urn:li:dataPlatform:dbt,fixture.order_summary,PROD)",
    "id": "consumer-dbt-order-summary",
    "native_identity": {
      "commit": "fixture-commit-0001",
      "path": "../specs/valid.yaml",
      "repository": "analytics"
    }
  },
  "evidence_status": "COMPLETE",
  "expected_source_fingerprint": "sha256:0000000000000000000000000000000000000000000000000000000000000000",
  "identity_match_count": 1,
  "mode": "fixture",
  "replacement_compatible": true,
  "schema_version": "1.0.0",
  "source_path": "../specs/valid.yaml",
  "source_version": "fixture-commit-0001"
}
